{
  "version": 1,
  "kind": "ticks",
  "broker": "ExampleBroker-Live",
  "instrument": "EURUSD",
  "period": {
    "start": "2024-01-02T10:00:00Z",
    "end": "2024-01-02T10:01:00Z"
  },
  "ticks": [
    {"time": "2024-01-02T10:00:00.120Z", "bid": 1.09512, "ask": 1.09520},
    {"time": "2024-01-02T10:00:01.874Z", "bid": 1.09513, "ask": 1.09521},
    {"time": "2024-01-02T10:00:07.003Z", "bid": 1.09510, "ask": 1.09519},
    {"time": "2024-01-02T10:00:42.500Z", "bid": 1.09525, "ask": 1.09533}
  ]
}
